title,content
[친절한경제] 국민 73% '팁 문화' 반대…현행법상 팁 강제 '불법',"<앵커> 화요일 친절한 경제 오늘(29일)도 경제부의 한지연 기자가 나와 있습니다. 한 기자 어서 오세요. (안녕하세요?) 한 기자, 오늘 얘기는 조금 생소한 얘기네요. 우리나라에서도 식당에서 팁을 달라는 데가 있어요? <기자> 먼저 좀 SNS에 올라온 사진 한 장을 보면, 이렇게 빨간 통에 팁박스라고 적혀 있는데요. 그 밑에는 ""식사 맛있게 하셨어요. 항상 최고의 서비스와 요리를 드리기 위해 노력하고 있습니다. 감사합니다"" 이런 문구가 적혀 있습니다. 지난 주말 여의도 한 식당을 다녀온 분이 계산대 팁 박스를 찍어서 올린 게 온라인상에서 화제가 되고 있습니다. 해당 글을 작성한 이용자는 ""여긴 한국이다. 팁 문화 들여오지 마라""며 불쾌감을 드러냈고, 이를 접한 다수의 누리꾼들도 ""언제부터 우리나라에 팁이 있었냐?""라는 글을 올리고, ""저러다 결국 강제되는 것 아니냐?""는 등의 부정적인 반응을 쏟아냈는데요. 팁 문화를 둘러싼 논란은 이번이 처음이 아니죠. 최근 몇 년 사이 국내에서도 팁을 받는 사례가 늘면서 논란이 일고 있습니다. 최근 한 냉면집이 직원 회식비 명목으로 300원을 추가하는 선택 항목을 키오스크에 넣어서 논란이 됐고, 2023년에는 한 유명 빵집이 계산대에 팁 박스를 비치했다가 여론의 비판을 받고, 점주가 이를 없앤 바가 있습니다. 세종시의 한 장어전문점에서도 ""서빙 직원이 친절히 응대했다면 테이블당 5천 원 정도의 팁을 부탁드린다""는 문구를 안내문에 붙여서 논란이 됐고요. 한 피자가게는 팁 2천 원을 함께 결제해야 주문을 할 수 있도록 해서 비판을 받은 바 있습니다. <앵커> 일단 얘기 듣고 드는 생각은 이런 팁을 요구하는 게 싫은 사람들은 그냥 그런 식당을 안 가면 될 것 같고, 만약에 팁을 내고도 좀 먹을 만하다 그러면 좀 낼 수도 있을 것 같은데요. <기자> 현행 '식품위생법'에 따르면 음식점은 메뉴판에 표기된 모든 가격은 부가세와 봉사료를 포함한 최종 결제 가격이어야 하며 고객에게 별도의 봉사료를 강제로 요구하거나 선택을 강제하는 행위는 불법이라고 명시돼 있습니다. 그럼 앞에 나왔던 경우들은 법을 어긴 거냐, 팁 요청이 강제성이 없이 선택사항일 경우에는 위법으로 보긴 어려워서요. 앞에서 언급한 대부분의 경우는 법을 어긴 건 아니고요. 팁을 함께 결제해야 주문을 할 수 있도록 한 경우만 위법성이 있다고 볼 수 있겠습니다. 국내 팁 문화 도입에 관해 설문조사가 이뤄졌었는데요. 73%가 절대 받아들일 수 없다는 강경한 입장을 보였고요. 좋은 서비스를 받을 수 있다면 적극 수용할 수 있다는 5%에 불과했습니다. 심지어는 팁 문화가 오래된 미국에서도 고물가 장기화와 키오스크가 확산되면서 팁을 얼마나 줘야 하는지를 두고 논란이 일고 있는데요. 설문조사 결과, 10명 중 7명은 팁 의무화에 반대했습니다. <앵커> 이번에는 좀 다른 얘기를 해보죠. 요새 휴가철이다 보니까 비행기 티켓 예매하시는 분들이 많은데 지각 출발, 지각 도착 가장 많이 하는 항공사가 어디인지 지금 조사 결과가 나왔다고요? <기자> 올해 상반기 전국 공항에서 집계된 10개 국내 항공사 평균 지연율은 23.6%인데요. 이 가운데 최고 지연율을 보인 곳은 에어서울로 나왔습니다. 얼마나 늦게 출발하고 도착해야 지연으로 분류하냐면요. 항공권에 표시된 예정 시각보다 15분 이상 늦게 게이트를 출발하거나 도착할 경우를 말하는데요. 올해 상반기 운항 된 항공편이 33만 편에 육박한데, 그중에 7만 8천 편 가까이 지연 운항이 됐습니다. 이 가운데 국내선은 19.6%에 달한 3만 3천 편이 넘었고요. 국제선은 27.8%인 4만 4천 편이 넘었습니다. 항공사별 지연율을 보면, 방금 말씀드린 에어 서울이 전체 노선에서 평균 36.5%로 가장 높았는데요. 에어 서울 항공편 3대 중 1대는 정시 출발 또는 도착하지 못하다는 계산이 나온 겁니다. 에어 서울은 국내선에서 28%, 국제선에서 41%로 지연되면서 두 부문 모두 최대 지연율을 기록했고요. 지난해 국토부 항공교통 서비스 평가 운항 신뢰성 부문에서 전체 국적항공사 중 가장 낮은 점수를 받은 바 있습니다. 국내선 기준으로 에어 서울 다음으로 진에어, 이스타항공 순으로 지연율이 높았고, 국제선 지연율에서는 진에어와 에어프레미아, 아시아나 항공이 그 뒤를 이었습니다."
"""전교 1등 우리 딸"" 주검으로…불탄 속옷에 무너진 아빠","피해자 고(故) 정은희 씨 아버지 정현조 씨 전교 1~2등을 놓치지 않았고, 집안의 자랑이었던 딸은 학교에 다녀온다고 나갔다가 다음 날 싸늘한 주검이 돼 돌아왔습니다. 성폭행 흔적이 있었고, 시신은 훼손된 상태였습니다. 고인의 아빠는 '민중의 지팡이' 경찰을 믿었지만 경찰은 딸의 죽음을 단순 교통사고로 봤습니다. 아버지는 끝까지 사인을 밝히겠다고 다짐했습니다. ""은희야, 오직 내 몸을 바쳐서라도 너의 억울한 죽음을 꼭 밝히고 말 것이다…."" 아빠는 동분서주했으나 사건은 해결되지 않았습니다. 딸의 죽음으로부터 27년이 흘렀고, 아빠는 70대 중반의 노인이 됐습니다. 그러나 아직도 그는 딸의 억울한 죽음을 해결하기 위해 남은 인생을 걸고 있습니다. '대구 여대생 성폭행 사망 사건' 피해자 고(故) 정은희 씨 아버지 정현조 씨 얘기입니다. 정 씨는 신간 '아빠의 전쟁'에서 ""지금이라도 다시 재수사가 시작되고 다시 재판이 이루어져야 한다""고 강조했습니다. 이어 ""은희의 한을 풀어주는 것은 물론이고, 앞으로도 있을 또 다른 은희, 또 다른 나와 같은 아빠가 있어서는 안 되기 때문""이라고 그 이유를 설명했습니다. 책은 사건 발생부터 현재까지의 이야기를 유족의 입장에서 상세하게 전합니다. 정 씨의 악몽은 사건을 인지한 1998년 10월 17일부터 계속되고 있다고 합니다. 딸 정은희 씨는 그해 10월 16일 학교 축제에 갔다가 이튿날, 구마고속도로(현 중부내륙고속도로)에서 숨진 채 발견됐습니다. 경찰은 은희 씨가 23t 덤프트럭에 치여 숨졌다고 전했습니다. 사고 현장에서 30여ｍ 떨어진 곳에서 고인의 속옷이 발견됐지만, 경찰은 단순 교통사고라고 결론지었습니다. 아빠는 항의했습니다. 차가 급정거하면 반드시 스키드마크(Skid mark·차량이 미끄러지면서 남는 바퀴 자국)가 남아야 하는데, 현장엔 전혀 그런 흔적이 없었다는 점, 덤프트럭에 부딪혀 사망했는데도 내부 장기 파열이 없었다는 점, 애초 발견된 시신에 속옷이 없었고, 추후 사고 현장 주변에서 발견됐다는 점 등을 근거로 교통사고가 아닌 강간 살인 사건이라고 주장했습니다. 특히 결정적 증거인 범인의 DNA가 담긴 속옷이 경찰 수사 과정에서 훼손됐다는 점도 지적했습니다. 그는 ""나중에 경찰이 국과수에 넘긴 은희의 속옷이 불에 탄 것처럼 검게 훼손되어 있었다""며 ""내가 처음 찾아낸 속옷의 상태와는 완전히 달랐다. 이에 대해 항의했지만, 경찰은 명확한 해명을 하지 못했다""고 주장했습니다. 경찰의 부실 수사 논란 속에 사건은 흐지부지됐습니다. 유족들은 끈질기게 문제를 제기했고, 검찰이 2013년 재수사에 나서 스리랑카인 K씨를 기소했으나 증거 부족 등의 이유로 1심과 2심에서 잇달아 패소했습니다. 저자는 ""검찰이 지목한 스리랑카인 K는 다른 성폭행 사건에 연루된 적이 있지만, 이번 사건의 진범은 아니다""라고 말했습니다. 딸의 죽음 후 20년 가까운 세월이 흘러도 진척이 없자 저자는 2017년 6월 국가를 상대로 손해배상 소송을 제기했습니다. 재판부는 1심에서 유족에게 5천500만 원을, 2심에선 위자료를 상향해 7천500만 원을 배상하라고 판시했습니다. 서울고법 민사15부는 ""경찰이 단순 교통사고로 성급히 판단해 현장 조사와 증거 수집을 하지 않고 증거물 감정을 지연해 극히 부실하게 초동수사를 한 것은 위법이다""고 판단했습니다. 또한 ""신속하게 현장에서 유품과 증거물을 수거해 피해자의 몸과 속옷에서 정액이나 지문을 확인했더라면 이 사건을 성범죄 등 강력 사건으로 판단했을 가능성이 매우 높고, 피해자 주변인과 행적 등에 대해 강도 높은 수사를 벌여 신속하게 범인을 잡을 수도 있었을 것""이라고 덧붙였습니다. 승소했지만, 변한 건 아무것도 없었습니다. 범인은 여전히 잡히지 않았고, 유족의 고통은 계속되고 있기 때문입니다. 저자는 제3의 범인이 있다고 추정하면서 ""교통사고가 있기 전에 이미 은희는 사망했고, 그 사망을 은폐하기 위해 교통사고로 위장, 조작했다고 볼 수 있다""고 주장했습니다. 그는 ""이 책을 내는 이유는 피해자와 유족들이 가지고 있는 그 숱한 의혹을 국가가 해소해 주기를 바라는 마음 때문""이라며 ""국가의 공권력은 국민을 위해 존재하는 것이며, 따라서 국민이 어떠한 의혹을 가지고 있다면, 최선을 다해 그것을 풀어주고 이해시켜 주어야 한다고 생각한다""고 호소했습니다. (사진=연합뉴스)"
미용 맡겼더니 때리고 밀치고…'학대 미용사' 결국,"미국 노스캐롤라이나주의 한 반려동물 전용 미용실입니다. 그런데 고객이 맡긴 반려견을 이렇게 다뤄도 되나요? 미용사가 반려견을 때리고 벽으로 밀치는 등 공격적으로 대하는 모습이 카메라에 포착됐습니다. 이 사건은 같이 근무하는 동료가 촬영해 인터넷에 공개하면서 널리 알려지게 됐는데, 당시 영상에 따르면 최소 반려견 4마리가 해당 미용사로부터 반복적인 폭행을 당했다고 하네요. 논란이 일자 현지 당국이 수사에 착수했고 결국 미용사는 동물 학대 혐의로 기소됐습니다. (화면출처 : 엑스 realnorma_kay, RevolvingSab, 틱톡 butrflybabe)"
베란다 방충망 찢고 침입해 위협…30대 강도 '충격' 정체,아파트에 침입해서 노인을 위협하고 금품을 훔친 30대 남자가 붙잡혔는데 그 정체가 충격적이라고요. 말씀하신 30대 남성 A 씨가 어제 새벽 포천 한 아파트에 침입해서 집주인인 80대 남자 B 씨를 위협하고 수천만 원어치의 귀금속과 현금을 훔친 혐의를 받고 있습니다. 당시 A 씨는 3층 베란다 방충망을 찢고 침입한 뒤에 B 씨를 위협했고 이 과정에서 저항하던 B 씨는 팔을 다쳐서 병원 치료를 받았습니다. 경찰은 수사 끝에 A 씨가 포천시 모 은행 직원이라는 사실을 확인하고 같은 날 오후 직장에서 A 씨를 긴급 체포했습니다. 경찰은 피해자 B 씨가 해당 은행의 고객이고 최근 현금을 인출했던 점 등을 토대로 A 씨가 집에 있는 현금을 노리고 범행을 사전에 계획한 것으로 보고 있습니다. 경찰은 현재 A 씨를 상대로 정확한 범행 동기와 경위를 조사하고 있습니다.
"제주 바다 뒤덮은 '푸른 곰팡이'…""닿으면 가려워"" 정체는",제주도 해안가에 푸른 곰팡이처럼 생긴 해파리 떼가 대거 나타나면서 피서객들의 우려가 커지고 있다고요. 최근 SNS를 보면 제주 김녕항 근처 해변에 푸르스름한 해파리 수백 마리가 떠다니는 영상이 올라왔습니다. 같은 날 신흥 해수욕장에서도 비슷한 장면이 포착되기도 했는데요. 피서객들 사이에서는 바다에 들어가도 되느냐라는 우려가 커지고 있습니다. 문제의 해파리는 태평양과 인도양 등 아열대 해역에서 서식하는 푸른 우산관 해파리로 지름이 3.4cm의 원형 몸체에 촉수를 지녀서 피부에 닿을 경우에 가려움 등 이상 반응을 일으킬 수 있습니다. 또한 죽은 뒤에도 외형이 남아 있어서 시각적으로 더 넓게 번진 것처럼 보일 수 있는데요. 제주도 해양수산연구원은 해파리가 조류와 바람을 타고 유입된 것으로 보인다며 현재 해수욕장 안전요원들이 수거 작업을 진행 중이라고 밝혔습니다. (화면출처 : 인스타그램)
"""동생 돌봐주면 60만 원""…2박 3일 가두고 성폭행","밤사이 인터넷에서 화제가 된 뉴스를 살펴보는 실시간 e뉴스 시간입니다. 중고 거래 플랫폼에 고액의 간병 아르바이트 구인 글이 올라왔는데요. 알고 보니 성폭행범이 올린 미끼였던 것으로 드러나 충격을 주고 있습니다. 지난 1월 한 중고거래 플랫폼에 오후 10시부터 다음 날 오전 10시까지 몸이 불편한 자신의 여동생을 돌봐주면 60만 원을 주겠다는 글이 올라왔습니다. 프로필 사진을 본인 사진으로 변경한 뒤 지원해달라는 좀 수상한 요청도 있었는데요. 해당 글은 성폭행범 안 모 씨가 범행 대상을 물색, 유인하기 위한 미끼였고요. 하반신 마비라고 했던 여동생은 처음부터 없었습니다. 안 씨는 해당 알바를 지원한 30대 여성 A 씨를 2박 3일간 감금하고 성폭행한 것으로 조사됐습니다. 안 씨는 A 씨와 연락이 되지 않는다는 지인의 신고를 받은 경찰에 의해 현행범으로 체포됐습니다. 법원은 지난 17일 안 씨에게 징역 10년을 선고했습니다. (화면출처 : 온라인커뮤니티)"
갈등 빚던 유튜버 라이브방송 중 보복살해 50대 무기징역 확정,"유튜버 살해한 50대 평소 갈등을 빚던 유튜버를 법원 앞에서 흉기로 무참히 살해한 50대 유튜버에게 무기징역이 확정됐습니다. 오늘(29일) 법조계에 따르면 대법원 3부(주심 노경필 대법관)는 특정범죄 가중처벌법상 보복살인 등 혐의로 기소된 홍 모(56)씨에게 무기징역을 선고한 원심 판결을 지난달 확정했습니다. 홍 씨는 지난해 5월 9일 오전 부산 연제구 부산법원종합청사 앞에서 생방송 중이던 다른 유튜버를 흉기로 살해하고 달아났다가 붙잡혔습니다. 홍 씨와 피해자는 비슷한 콘텐츠를 만들어 방송하면서 2023년부터 서로 비방해 200건에 달하는 고소·고발을 주고받는 등 갈등을 빚어왔습니다. 그는 사건 당일에도 자신을 상해 혐의로 고소한 재판에 참석할 예정인 피해자를 진술하지 못하게 할 목적으로 범행을 저지른 것으로 조사됐습니다. 작년 11월 1심은 홍 씨가 보복 목적으로 피해자를 살해한 사실을 인정해 무기징역을 선고하고 10년간 위치추적 전자장치 부착을 명령했습니다. 당시 1심 재판부는 ""보복 범죄는 개인의 법익을 침해할 뿐 아니라 국가의 형벌권 행사를 방해하는 결과를 초래하는 것이어서 비난 가능성이 매우 크고 더욱 엄정하게 대응할 필요성이 있다""며 ""범행 당시 피해자가 유튜브로 라이브 방송을 진행 중이었기에 그 범행 장면이 생방송으로 그대로 중계돼 많은 국민들에게 큰 충격과 공포감을 안겨줬다""고 양형 이유를 밝혔습니다. 홍 씨가 판결에 불복해 상소했으나 2심과 대법원도 이런 판단에 잘못이 없다고 보고 무기징역을 유지했습니다. (사진=연합뉴스)"
병원 주차장서 20대 여성 흉기 찔려 중태…시민들이 범인 제압,"28일 오후 울산 북구의 한 병원 주차장에서 30대 남성이 20대 여성에게 흉기를 휘둘러 다치게 한 사건이 발생했다. 사진은 피의자가 도주를 시도하려 탑승한 차량 유리가 시민들에 의해 깨져 있는 모습. 대낮 울산의 한 병원 주차장에서 20대 여성이 흉기에 찔려 중태에 빠졌습니다. 당시 사건 현장을 목격한 시민들이 도망치려는 범인을 제압해 경찰에 넘겼습니다. 울산 북부경찰서는 어제(28일) 살인미수 혐의로 30대 남성 A 씨를 조사 중이라고 밝혔습니다. A 씨는 이날 오후 3시 38분 울산 북구의 한 병원 주차장에서 20대 여성 B 씨에게 흉기를 휘둘러 다치게 한 혐의를 받습니다. 그는 야외에 있는 지상 주차장에서 범행한 뒤에 차를 타고 도주를 시도했습니다. A 씨를 붙잡은 것은 이를 목격한 시민들이었습니다. 사건 당시 근처에 있던 시민 5∼6명은 A 씨가 탄 차량 앞을 맨몸으로 막아서거나, 소화기로 차량 유리를 깨는 등의 방법으로 도주를 막았습니다. 사건 현장에는 A 씨 탑승 차량의 앞뒤 유리가 산산이 깨져있어 긴박했던 당시 상황을 짐작하게 했습니다. 신고를 받고 출동한 경찰은 시민들에게 제압된 A 씨를 체포했습니다. 피해자 B 씨는 이 병원에서 응급수술을 받았습니다. 경찰은 범행에 사용된 흉기를 회수하고 현장 폐쇄회로(CCTV)를 분석하며 범행 동기 등 자세한 사건 경위를 조사하고 있습니다. 경찰은 조사가 끝나는 대로 A 씨에 대한 구속영장을 신청할 방침입니다. A 씨 검거에 도움을 준 시민들에게는 표창장 수여를 검토할 예정입니다. (사진=연합뉴스)"
